<?xml version="1.0" ?>
<!DOCTYPE Manifest SYSTEM "submission.dtd">
<Manifest>
    <submission>
        <trainingprovider tpemail="cafspoperations@utk.edu" tpid="UT-CVM" tpphone="8659740757">
            <class catalognum="MGT-489" classtype="I" classcity="Houston" classstate="TX" classzipcode="77024" startdate="7252023" enddate="7262023" numstudent="9" trainingmethod="M">
                <instructorpoc instlastname="Palumbo-Miele" instfirstname="Donna" instphone="3213324048" instemail="donna@concordiasupplychain.com"/>
                <instructorpoc instlastname="Miller" instfirstname="Steven" instphone="8659746530" instemail="steve@londonpacket.com"/>
                <registration>
                    <student sid="5119373" studentlastname="Fawcett" studentfirstname="Ronald" international="N" studentcity="Sugar Land" studentstate="TX" studentzipcode="77498" studentemail="ronald.fawcett@fortbendcountytx.gov" studentphone="2819808685" govnlevel="L" discipline="EM"/>
                    <student sid="6159063" studentlastname="Hannan" studentfirstname="James" international="N" studentcity="Kingwood" studentstate="TX" studentzipcode="77345" studentemail="jamie.hannan@oem.hctx.net" studentphone="2817990320" govnlevel="L" discipline="EM"/>
                    <student sid="4568419" studentlastname="Jimenez" studentfirstname="Casey" international="N" studentcity="Bedford" studentstate="TX" studentzipcode="76022" studentemail="casey.account@yahoo.com" studentphone="8176823349" govnlevel="L" discipline="EM"/>
                    <student sid="588939" studentlastname="menke" studentfirstname="mardie" international="N" studentcity="Houston" studentstate="TX" studentzipcode="77024" studentemail="mardie.menke@oem.hctx.net" studentphone="7134269539" govnlevel="L" discipline="EM"/>
                    <student sid="5510706" studentlastname="Pastrano" studentfirstname="Thomas" international="N" studentcity="Tomball" studentstate="TX" studentzipcode="77377" studentemail="thomas.pastrano@houstontx.gov" studentphone="2812579291" govnlevel="L" discipline="EM"/>
                    <student sid="610409" studentlastname="Shryock" studentfirstname="Brett" international="N" studentcity="Houston" studentstate="TX" studentzipcode="77024" studentemail="brett.shryock@oem.hctx.net" studentphone="3614011266" govnlevel="L" discipline="EM"/>
                    <student sid="4175363" studentlastname="Stevenson" studentfirstname="Keyona" international="N" studentcity="Houston" studentstate="TX" studentzipcode="77024" studentemail="Keyona.stevenson@oem.hctx.net" studentphone="7138813100" govnlevel="L" discipline="EM"/>
                    <student sid="303930" studentlastname="suter" studentfirstname="Jennifer" international="N" studentcity="Houston" studentstate="TX" studentzipcode="77024" studentemail="jennifer.suter@att.net" studentphone="7134269544" govnlevel="L" discipline="EM"/>
                    <student sid="893859" studentlastname="Vargas" studentfirstname="Cynthia" international="N" studentcity="Rosharon" studentstate="TX" studentzipcode="77583" studentemail="vargasc@uhd.edu" studentphone="8326511466" govnlevel="NA" discipline="EM"/>
                </registration>
                <evaluations>
                    <evaldata>
                        <question answer="3" id="1"/>
                        <question answer="4" id="2"/>
                        <question answer="4" id="3"/>
                        <question answer="5" id="4"/>
                        <question answer="5" id="5"/>
                        <question answer="5" id="6"/>
                        <question answer="0" id="7"/>
                        <question answer="0" id="8"/>
                        <question answer="0" id="9"/>
                        <question answer="0" id="10"/>
                        <question answer="0" id="11"/>
                        <question answer="0" id="12"/>
                        <question answer="0" id="13"/>
                        <question answer="0" id="14"/>
                        <question answer="4" id="15"/>
                        <question answer="4" id="16"/>
                        <question answer="0" id="17"/>
                        <question answer="4" id="18"/>
                        <question answer="4" id="19"/>
                        <question answer="4" id="20"/>
                        <question answer="4" id="21"/>
                        <question answer="4" id="22"/>
                        <question answer="4" id="23"/>
                        <comment answer="nan" id="24"/>
                        <comment answer="nan" id="25"/>
                        <comment answer="nan" id="26"/>
                        <comment answer="nan" id="27"/>
                    </evaldata>
                    <evaldata>
                        <question answer="3" id="1"/>
                        <question answer="4" id="2"/>
                        <question answer="4" id="3"/>
                        <question answer="4" id="4"/>
                        <question answer="2" id="5"/>
                        <question answer="4" id="6"/>
                        <question answer="5" id="7"/>
                        <question answer="5" id="8"/>
                        <question answer="5" id="9"/>
                        <question answer="5" id="10"/>
                        <question answer="5" id="11"/>
                        <question answer="5" id="12"/>
                        <question answer="4" id="13"/>
                        <question answer="5" id="14"/>
                        <question answer="4" id="15"/>
                        <question answer="4" id="16"/>
                        <question answer="4" id="17"/>
                        <question answer="4" id="18"/>
                        <question answer="4" id="19"/>
                        <question answer="5" id="20"/>
                        <question answer="5" id="21"/>
                        <question answer="5" id="22"/>
                        <question answer="5" id="23"/>
                        <comment answer="The subject matter in general was new to me so the whole course was valuable. I think the models explaining supply chains and identifying issues utilizing maps and GIS were most helpful" id="24"/>
                        <comment answer="There were too many activities or too much time allocated for them. I found myself losing interest with the amount of time given." id="25"/>
                        <comment answer="I am interested in finding more supply chain and critical infrastructure trainings." id="26"/>
                        <comment answer="Mainly reducing the number of activities or time allocated for them." id="27"/>
                    </evaldata>
                    <evaldata>
                        <question answer="2" id="1"/>
                        <question answer="4" id="2"/>
                        <question answer="5" id="3"/>
                        <question answer="5" id="4"/>
                        <question answer="5" id="5"/>
                        <question answer="5" id="6"/>
                        <question answer="5" id="7"/>
                        <question answer="5" id="8"/>
                        <question answer="5" id="9"/>
                        <question answer="5" id="10"/>
                        <question answer="5" id="11"/>
                        <question answer="5" id="12"/>
                        <question answer="5" id="13"/>
                        <question answer="5" id="14"/>
                        <question answer="5" id="15"/>
                        <question answer="5" id="16"/>
                        <question answer="5" id="17"/>
                        <question answer="5" id="18"/>
                        <question answer="5" id="19"/>
                        <question answer="5" id="20"/>
                        <question answer="5" id="21"/>
                        <question answer="5" id="22"/>
                        <question answer="5" id="23"/>
                        <comment answer="Hands on use of the RAPT tool" id="24"/>
                        <comment answer="Too many class activities were tiring" id="25"/>
                        <comment answer="O-305" id="26"/>
                        <comment answer="Cut the group activities in half.  Midway through the second day I felt mentally exhausted and was just going through the motions." id="27"/>
                    </evaldata>
                    <evaldata>
                        <question answer="2" id="1"/>
                        <question answer="3" id="2"/>
                        <question answer="5" id="3"/>
                        <question answer="5" id="4"/>
                        <question answer="5" id="5"/>
                        <question answer="5" id="6"/>
                        <question answer="5" id="7"/>
                        <question answer="5" id="8"/>
                        <question answer="5" id="9"/>
                        <question answer="5" id="10"/>
                        <question answer="5" id="11"/>
                        <question answer="5" id="12"/>
                        <question answer="5" id="13"/>
                        <question answer="5" id="14"/>
                        <question answer="4" id="15"/>
                        <question answer="5" id="16"/>
                        <question answer="5" id="17"/>
                        <question answer="4" id="18"/>
                        <question answer="4" id="19"/>
                        <question answer="5" id="20"/>
                        <question answer="5" id="21"/>
                        <question answer="5" id="22"/>
                        <question answer="5" id="23"/>
                        <comment answer="The activities were of a great value in being able to think and work through processes." id="24"/>
                        <comment answer="Nothing." id="25"/>